{
  "id": "PROFILE-0001",
  "kind": "rule_profile",
  "version": "1.1.0",
  "title": "C-to-Rust Strict Port - Lite",
  "status": "draft",
  "selected_rule_ids": [
    "NOM-0001",
    "NOM-0003",
    "NOM-0004",
    "NOM-0012",
    "NOM-0014",
    "NOM-0015",
    "NOM-0016",
    "NOM-0017",
    "NOM-0018",
    "NOM-0019",
    "NOM-0020",
    "NOM-0021",
    "NOM-0022",
    "NOM-0023",
    "NOM-0024",
    "NOM-0025",
    "NOM-0026",
    "NOM-0027",
    "NOM-0028",
    "NOM-0029",
    "NOM-0030",
    "NOM-0031",
    "NOM-0032",
    "NOM-0033",
    "NOM-0044",
    "NOM-0049",
    "NOM-0050",
    "NOM-0051",
    "NOM-0053",
    "NOM-0054",
    "NOM-0062",
    "NOM-0064",
    "NOM-0065",
    "NOM-0066",
    "NOM-0067",
    "NOM-0074",
    "NOM-0075",
    "NOM-0076",
    "NOM-0111",
    "NOM-0112",
    "NOM-0113",
    "NOM-0138",
    "NOM-0142",
    "NOM-0143",
    "NOM-0145",
    "NOM-0146",
    "NOM-0200",
    "NOM-0201",
    "NOM-0203",
    "NOM-0204",
    "NOM-0205",
    "NOM-0207",
    "NOM-0208",
    "NOM-0209",
    "NOM-0211",
    "NOM-0212",
    "NOM-0213",
    "NOM-0214",
    "NOM-0216",
    "NOM-0221",
    "NOM-0222"
  ],
  "export_targets": [
    "agents_md",
    "chatgpt_custom_instructions",
    "plain_text"
  ],
  "review": {
    "selection_confirmed": true,
    "finalization_confirmed": false
  },
  "governance": {
    "created_on": "2026-10-21",
    "updated_on": "2026-10-25"
  }
}
